regionidzip,latitude,longitude,address
0.096325,34.172392,-118.198221,"Buckingham Road, Montrose, Glendale, Los Angeles County, California, 91208, United States of America"
0.096326,34.173097,-118.25529,"Rimcrest Drive, Montrose, Glendale, Los Angeles County, California, 91204, United States of America"
0.096327,34.206067,-118.234071,"Angelus Avenue, Sparr Heights, Montrose, Glendale, Los Angeles County, California, 91046, United States of America"
0.096329,34.143427,-118.254731,"Jamba Juice, S Brand Boulevard, Glendale, Los Angeles County, California, 91204, United States of America"
0.09633,34.245329,-118.256751,"Henrietta Avenue, Glendale, Los Angeles County, California, 91214, United States of America"
0.096336,34.156664,-118.753818,"Gleam Court, Agoura Hills, Los Angeles County, California, 91301, United States of America"
0.096337,34.144442,-118.654084,"Tedregal Court, Calabasas, Los Angeles County, California, 91302, United States of America"
0.096338,34.205282,-118.60739,"Runnymede Street, Canoga Park, LA, Los Angeles County, California, 91311, United States of America"
0.096339,34.228588,-118.592886,"Variel Avenue, Canoga Park, LA, Los Angeles County, California, 91311, United States of America"
0.096341,34.21424,-118.567127,"Hemmingway Street, Winnetka, LA, Los Angeles County, California, 91311, United States of America"
0.096342,34.211196,-118.69102,"Ranchero Road, Bell Canyon, Ventura County, California, United States of America"
0.096346,34.245616,-118.596393,"Superior Street, Chatsworth, LA, Los Angeles County, California, 91311, United States of America"
0.096349,34.186094,-118.523907,"Enfield Avenue, Reseda, LA, Los Angeles County, California, 91406-5441, United States of America"
0.096351,34.196427,-118.958804,"Vista Conejo, Thousand Oaks, Ventura County, California, 91320, United States of America"
0.096352,34.371722,-118.558041,"Hawkbryn Avenue, Newhall, Santa Clarita, Los Angeles County, California, 91381, United States of America"
0.096354,34.233366,-118.549198,"Vanalden Avenue, Porter Ranch, Los Angeles County, California, 91311, United States of America"
0.096355,34.220631,-118.521001,"Roscoe Boulevard, Northridge, LA, Los Angeles County, California, 91325-3301, United States of America"
0.096356,34.291173,-118.577875,"Androwe Lane, Chatsworth, LA, Los Angeles County, California, 91326-4109, United States of America"
0.096361,34.267763,-118.406278,"Glenoaks Boulevard, Pacoima, LA, Los Angeles County, California, 91331-2536, United States of America"
0.096364,34.189273,-118.545075,"Easy Street, Reseda, LA, Los Angeles County, California, 91335, United States of America"
0.096366,34.289776,-118.432085,"De Garmo Street, San Fernando, Los Angeles County, California, 91340, United States of America"
0.096368,34.3089,-118.461613,"Bledsoe Street, Sylmar, LA, Los Angeles County, California, 91342-4119, United States of America"
0.096369,34.249449,-118.456014,"Lassen Street, North Hills, Los Angeles County, California, 91343, United States of America"
0.09637,34.265214,-118.520217,"Deodar Cedar, White Oak Avenue, Granada Hills, Northridge, LA, Los Angeles County, California, CA 91344, United States of America"
0.096371,34.271503,-118.467494,"Sepulveda Boulevard, Mission Hills, Sylmar, LA, Los Angeles County, California, 91343, United States of America"
0.096373,34.416889,-118.505805,"Ashley Furniture Homestore, 26520, Golden Triangle Road, Honby, Canyon Country, Santa Clarita, Los Angeles County, California, 91350, United States of America"
0.096374,34.41358,-118.459677,"Santa Clara River Trail, Mint Canyon, Canyon Country, Santa Clarita, Los Angeles County, California, 91351-3521, United States of America"
0.096375,34.2144,-118.373,"Arminta Street, Sun Valley, North Hollywood, LA, Los Angeles County, California, 91352, United States of America"
0.096377,34.447747,-118.565056,"Copperstone Drive, Valencia, Santa Clarita, Los Angeles County, California, 91354, United States of America"
0.096378,34.389913,-118.565719,"Vista Fairways Drive, Valencia, Santa Clarita, Los Angeles County, California, 91381, United States of America"
0.096379,34.174112,-118.561783,"Martha Street, Tarzana, LA, Los Angeles County, California, 91356-3213, United States of America"
0.096383,34.230516,-118.874495,"Lucero Street, Thousand Oaks, Ventura County, California, 91360, United States of America"
0.096384,34.147257,-118.873132,"Abbotsbury Street, Greenwich Village, Ventura County, California, 911360, United States of America"
0.096385,34.167903,-118.834113,"East Thousand Oaks Boulevard, Thousand Oaks, Ventura County, California, 91361, United States of America"
0.096387,34.158658,-118.62574,"Bruges Avenue, Woodland Hills, LA, Los Angeles County, California, 91302, United States of America"
0.096389,34.1843,-118.657,"Victory Boulevard, West Hills, LA, Los Angeles County, California, 91302, United States of America"
0.096393,34.192915,-118.777662,"Gentilly Place, Oak Park, Ventura County, California, 91377, United States of America"
0.096395,34.391119,-118.582241,"Burns Place, Stevenson Ranch, Los Angeles County, California, 91381, United States of America"
0.096398,34.49154,-118.625952,"Cherry Drive, Castaic, Los Angeles County, California, 91384, United States of America"
0.096401,34.422842,-118.424483,"Sand Canyon Road, Mint Canyon, Sand Canyon, Santa Clarita, Los Angeles County, California, 91387, United States of America"
0.096403,34.485778,-118.464883,"Bouquet Canyon Road, Saugus, Santa Clarita, Los Angeles County, California, 91390, United States of America"
0.09641,34.18997,-118.442326,"Haynes Street, North Sherman Way, Van Nuys, LA, Los Angeles County, California, 91401-2649, United States of America"
0.096411,34.219118,-118.463609,"Burnet Avenue, North Hills, Los Angeles County, California, 91343, United States of America"
0.096412,34.1654,-118.465,"Nazareth House for Boys, Magnolia Boulevard, Sherman Oaks, LA, Los Angeles County, California, 91403-1530, United States of America"
0.096414,34.208749,-118.451998,"Tobias Avenue, North Sherman Way, Panorama City, LA, Los Angeles County, California, 91343, United States of America"
0.096415,34.209694,-118.498313,"Saticoy Street, Reseda, LA, Los Angeles County, California, 91406-1232, United States of America"
0.09642,34.189288,-118.458962,"Hamlin Street, North Sherman Way, Van Nuys, LA, Los Angeles County, California, 91411, United States of America"
0.096424,34.148863,-118.437206,"Costello Avenue, Sherman Oaks, LA, Los Angeles County, California, 91423, United States of America"
0.096426,34.159751,-118.495101,"Rubio Avenue, Encino, LA, Los Angeles County, California, 91316-3402, United States of America"
0.096433,34.1802,-118.301,"East Providencia Avenue, Burbank, Los Angeles County, California, 91501, United States of America"
0.096434,34.171345,-118.3149,"West Tujunga Avenue, Burbank, Los Angeles County, California, 91502, United States of America"
0.096436,34.21821,-118.331311,"Wedgewood Lane, Burbank, Los Angeles County, California, 91504, United States of America"
0.096437,34.208671,-118.349039,"Hollywood Way, North Hollywood, LA, Los Angeles County, California, 91504, United States of America"
0.096438,34.181892,-118.335918,"North Lincoln Street, Burbank, Los Angeles County, California, 91504, United States of America"
0.096446,34.171873,-118.380906,"First Assembly of God Church, Burbank Boulevard, North Hollywood, LA, Los Angeles County, California, 91601-3121, United States of America"
0.096447,34.156294,-118.375507,"Blix Street, La Paco, North Hollywood, LA, Los Angeles County, California, 91602-2121, United States of America"
0.096449,34.154223,-118.409176,"Sarah Street, Studio City, Valley Village, LA, Los Angeles County, California, CA 91607, United States of America"
0.09645,34.194168,-118.385816,"Vanowen Street, Hewitt, North Hollywood, LA, Los Angeles County, California, 91605-5738, United States of America"
0.096451,34.1906,-118.371,"Kittridge Street, Hewitt, North Hollywood, LA, Los Angeles County, California, 91606, United States of America"
0.096452,34.178694,-118.39236,"Radford Avenue, Garnsey, North Hollywood, LA, Los Angeles County, California, 91606, United States of America"
0.096453,34.143139,-118.335438,"Forest Lawn Drive, Hollywood Hills, LA, Los Angeles County, California, 90028, United States of America"
0.096464,34.113493,-117.912914,"Boulder Street, Azusa, Los Angeles County, California, 91702, United States of America"
0.096465,34.105016,-117.9427,"Azusa Canyon Road, Baldwin Park, Los Angeles County, California, 91706, United States of America"
0.096467,34.021308,-117.74795,"Chino Valley Freeway, Pomona, Los Angeles County, California, 91766, United States of America"
0.096469,34.111749,-117.742921,"Lealma Avenue, Claremont, Los Angeles County, California, 91711, United States of America"
0.096473,34.098516,-117.909131,"North Azusa Avenue, Covina, Los Angeles County, California, 91722, United States of America"
0.096474,34.088576,-117.872956,"North Grand Avenue, Covina, Los Angeles County, California, 91740, United States of America"
0.096475,34.105887,-117.841113,"Foothill Transit 492, East Arrow Highway, Charter Oak, Los Angeles County, California, 91740, United States of America"
0.096478,34.089943,-118.02572,"Ranchito Street, El Monte, Los Angeles County, California, 91732, United States of America"
0.096479,34.047198,-118.013567,"South Riverside, El Monte, Los Angeles County, California, 91731, United States of America"
0.09648,34.035689,-118.042899,"Durfee Avenue, South El Monte, Los Angeles County, California, 91731, United States of America"
0.096485,34.128204,-117.874545,"West Alosta Avenue, Glendora, Los Angeles County, California, 91740, United States of America"
0.096486,34.143092,-117.883804,"West Leadora Avenue, Glendora, Los Angeles County, California, 91741, United States of America"
0.096488,34.016009,-117.947459,"Abbey Street, La Puente, Los Angeles County, California, 91744, United States of America"
0.096489,34.031186,-118.003857,"Wildwood Way, Hacienda Heights, Avocado Heights, Los Angeles County, California, 91744, United States of America"
0.09649,34.044283,-117.990464,"Workman Mill Road, Industry, Los Angeles County, California, 91706, United States of America"
0.096492,33.991203,-117.892272,"Willow Street, Otterbein, Los Angeles County, California, 91748, United States of America"
0.096494,34.093087,-117.758576,"Sierra Way, Le Verne, Los Angeles County, California, 91750, United States of America"
0.096496,34.057079,-118.15715,"Alzado Street, Monterey Park, Los Angeles County, California, 91754, United States of America"
0.096497,34.0656,-118.119,"North Nicholson Avenue, Monterey Park, Los Angeles County, California, 91776, United States of America"
0.0965,34.2392,-117.661,"Bear Canyon Drive, Mount Baldy, Los Angeles County, California, 91784, United States of America"
0.096505,33.971033,-117.850666,"Brea Canyon Cut Off Road, Diamond Bar, Los Angeles County, California, 91789, United States of America"
0.096506,34.041235,-117.791327,"Rancho Laguna Drive, Pomona, Los Angeles County, California, 91766, United States of America"
0.096507,34.110741,-117.745979,"Briarcroft Road, Claremont, Los Angeles County, California, 91711, United States of America"
0.096508,34.046387,-117.815445,"Polyona Islander, Pomona Islander Mobile Home Park, Pomona, Los Angeles County, California, 91765, United States of America"
0.09651,34.061774,-118.075048,"Stingle Avenue, Rosemead, Los Angeles County, California, 91776, United States of America"
0.096513,34.10401,-117.832104,"Elm, San Dimas, Los Angeles County, California, 91773, United States of America"
0.096514,34.107315,-118.105442,"Milton Drive, San Gabriel, Los Angeles County, California, 91776, United States of America"
0.096515,34.096844,-118.107664,"San Gabriel Mission Elementary School, South Mission Drive, San Gabriel, Los Angeles County, California, 91776, United States of America"
0.096517,34.115784,-118.067442,"Oak Avenue, Temple City, Los Angeles County, California, 91770, United States of America"
0.096522,34.007975,-117.841778,"Washington Street, Diamond Bar, Los Angeles County, California, 91765, United States of America"
0.096523,34.087918,-117.933584,"Irwindale Avenue Frontage Road, Orange Avenue Junction, Los Angeles County, California, 91706, United States of America"
0.096524,34.067264,-117.870419,"Grand Avenue, West Covina, Los Angeles County, California, 91791, United States of America"
0.096525,34.012754,-117.868819,"South Flemington Drive, West Covina, Los Angeles County, California, 91792, United States of America"
0.096531,34.096065,-118.15253,"Mobil, Main Street, Alhambra, Los Angeles County, California, 91030, United States of America"
0.096533,34.086959,-118.152878,"7-Eleven, Commonwealth Avenue, Alhambra, Los Angeles County, California, 91030, United States of America"
0.096859,34.359245,-117.652935,"Cardinal Road, Los Angeles County, California, United States of America"
0.096939,33.737185,-117.751869,"Stetson, Orchard Hills, Irvine, Orange County, California, 92602, United States of America"
0.09694,33.633459,-117.819377,"Sierra Mia Road, Turtle Rock, Irvine, Orange County, California, 92617, United States of America"
0.096941,33.693663,-117.776048,"Comet Street, El Camino Real, Irvine, Orange County, California, 92604, United States of America"
0.096943,33.691186,-117.802785,"Santa Eulalia, Westpark, Irvine, Orange County, California, 92606, United States of America"
0.096946,33.686874,-117.668433,"40, Fairfield, Foothill Ranch, Lake Forest, Orange County, California, 92610, United States of America"
0.096947,33.659879,-117.808611,"Tamarack Way, Woodbridge, Irvine, Orange County, California, 92612, United States of America"
0.096948,33.673481,-117.823935,"Beaver Street, Woodbridge, Irvine, Orange County, California, 92614, United States of America"
0.096951,33.634949,-117.83234,"University Hills Space Park, Pauling Court, University Hills, Turtle Rock, Irvine, Orange County, California, 92617, United States of America"
0.096952,33.700729,-117.727933,"157, Speckled Alder, Residential Area, Irvine, Orange County, California, 92618, United States of America"
0.096953,33.729743,-117.630722,"Pleasant Avenue, Silverado, Orange County, California, 92676, United States of America"
0.096954,33.687181,-117.753231,"78, Gardenhouse Way, Cypress Village, Irvine, Orange County, California, 92620, United States of America"
0.096956,33.458346,-117.66639,"Calle Las Flores, Dana Point, Orange County, California, 92624, United States of America"
0.096957,33.605048,-117.879367,"Altura Drive, Corona del Mar, Newport Beach, Orange County, California, 92625, United States of America"
0.096958,33.690321,-117.927266,"Michigan Avenue, Costa Mesa, Orange County, California, 92626, United States of America"
0.096959,33.646579,-117.902609,"Camellia Lane, Costa Mesa, Orange County, California, 92627, United States of America"
0.096961,33.480095,-117.683016,"Via Lenita, San Juan Capistrano, Orange County, California, 92629, United States of America"
0.096962,33.670038,-117.687276,"Goldenrod, The Highlands at Baker Ranch, Foothill Ranch, Lake Forest, Orange County, California, 92618, United States of America"
0.096963,33.6168,-117.717,"Via Puerta, Laguna Woods, Orange County, California, 92691, United States of America"
0.096964,33.641123,-117.968513,"Islander Lane, Huntington Beach, Orange County, California, 92646, United States of America"
0.096965,33.720658,-117.978309,"Lucia Lane, Little Saigon, Westminster, Orange County, California, 92647, United States of America"
0.096966,33.674655,-118.001047,"Main Street, Huntington Beach, Orange County, California, 92648, United States of America"
0.096967,33.723568,-118.051714,"Huntington Harbor Mhp, Huntington Harbor Mobile Home Park, Huntington Beach, Orange County, California, 92649, United States of America"
0.096969,33.555282,-117.808999,"Shamrock Road, Laguna Beach, Orange County, California, 92651, United States of America"
0.096971,33.620265,-117.734529,"Ancona, Laguna Hills, Orange County, California, 92653, United States of America"
0.096973,33.746236,-117.984714,"Washington Avenue, Little Saigon, Midway City, Orange County, California, 92655, United States of America"
0.096974,33.603115,-117.721337,"Via San Pablo, Aliso Viejo, Orange County, California, 92656, United States of America"
0.096975,33.601303,-117.828881,"Seahaven, Corona del Mar, Newport Beach, Orange County, California, 92617, United States of America"
0.096978,33.621178,-117.879309,"Colony Plaza, Newport Center, Newport Beach, Orange County, California, 92661, United States of America"
0.096979,33.604844,-117.911645,"West Balboa Boulevard, Balboa Island, Newport Beach, Orange County, California, 92663, United States of America"
0.09698,33.607797,-117.89304,"Coral Avenue, Balboa Island, Newport Beach, Orange County, California, 92662, United States of America"
0.096981,33.629016,-117.951505,"Orange Street, Newport Beach, Orange County, California, 92663, United States of America"
0.096982,33.434117,-117.609973,"253, Avenida la Cuesta, San Clemente, Orange County, California, 92672, United States of America"
0.096983,33.460948,-117.652416,"Calle Casino, San Clemente, Orange County, California, 92673, United States of America"
0.096985,33.490209,-117.682327,"Via Inez Road, San Juan Capistrano, Orange County, California, 92675, United States of America"
0.096986,33.708355,-117.628966,"Modjeska Canyon Road, Foothill Ranch, Modjeska, Orange County, California, 92679, United States of America"
0.096987,33.559707,-117.703756,"Motherlode Court, Village Niguel Heights, Laguna Niguel, Orange County, California, 92677, United States of America"
0.096988,33.661775,-117.588518,"Mountain View Road, Robinson Ranch, Trabuco Canyon, Orange County, California, 92679, United States of America"
0.096989,33.68303,-117.627491,"28846, Oakview Lane, Foothill Ranch, Lake Forest, Orange County, California, 92679, United States of America"
0.09699,33.748083,-117.948108,"Mast Avenue, Garden Grove, Orange County, California, 92683, United States of America"
0.096993,33.58166,-117.627096,"Crystalaire, Las Flores, Ladera Ranch, Orange County, California, 92691, United States of America"
0.096995,33.61213,-117.686996,"Roma Drive, Mission Viejo, Orange County, California, 92691, United States of America"
0.096996,33.5445,-117.663289,"Escalona Drive, Mission Viejo, Orange County, California, 92692, United States of America"
0.096998,33.525974,-117.621817,"Glicina Street, Orange County, California, 92675, United States of America"
0.097001,33.736919,-117.868107,"West Highland Street, Santa Ana, Orange County, California, 92701, United States of America"
0.097003,33.7465,-117.925,"1st Street, Santa Ana, Orange County, California, 92683, United States of America"
0.097004,33.735581,-117.933454,"South Corta Drive, Santa Ana, Orange County, California, 92704, United States of America"
0.097005,33.775205,-117.819795,"Romelle Avenue, Orange, Orange County, California, 92705, United States of America"
0.097006,33.768121,-117.884235,"Marion Way, Santa Ana, Orange County, California, 92706, United States of America"
0.097007,33.734732,-117.876331,"South Flower Street, Santa Ana, Orange County, California, 92703, United States of America"
0.097008,33.731647,-117.938405,"Royale Court, Fountain Valley, Orange County, California, 92708, United States of America"
0.097016,33.72665,-117.808465,"Seville Street, Villa Valencia Mobile Estates, Browning, Tustin, Orange County, California, 92780, United States of America"
0.097018,33.737521,-117.796655,"Carrera, Tustin Ranch, Tustin, Orange County, California, 92782, United States of America"
0.09702,33.836971,-117.933639,"West Wedgewood Drive, West Anaheim, Anaheim, Orange County, California, 92801, United States of America"
0.097021,33.821348,-117.92735,"West Chateau Avenue, West Anaheim, Anaheim, Orange County, California, 92801, United States of America"
0.097023,33.827543,-117.994994,"Baker Drive, Anaheim, Orange County, California, 90680, United States of America"
0.097024,33.837704,-117.92113,"Harbor Boulevard, West Anaheim, Anaheim, Orange County, California, 92801, United States of America"
0.097025,33.846974,-117.87614,"5B, Orange Freeway, Anaheim, Orange County, California, 92831, United States of America"
0.097026,33.836325,-117.773025,"Ruby Lane, Anaheim Hills, Anaheim, Orange County, California, 92807, United States of America"
0.097027,33.867668,-117.739343,"East Saratoga Street, Anaheim Hills, Anaheim, Orange County, California, 92808, United States of America"
0.097035,33.907003,-117.898485,"East Alder Street, Downtown Brea, Brea, Orange County, California, 92821, United States of America"
0.097037,33.910143,-117.84749,"Nasa Street, Brea, Orange County, California, 92821, United States of America"
0.097039,33.875305,-117.910794,"North Lincoln Avenue, Downtown Fullerton, Fullerton, Orange County, California, 92831, United States of America"
0.09704,33.863685,-117.938506,"West Rosslynn Avenue, Downtown Fullerton, Fullerton, Orange County, California, 92832, United States of America"
0.097041,33.867686,-117.978094,"Kellogg Avenue, Fuller Park, Fullerton, Orange County, California, 92833, United States of America"
0.097043,33.881381,-117.937544,"North Woods Avenue, Downtown Fullerton, Fullerton, Orange County, California, 92835, United States of America"
0.097047,33.777493,-117.942733,"Stanford Avenue, Koreatown, Garden Grove, Orange County, California, 92840, United States of America"
0.097048,33.791627,-117.983585,"Yana Drive, Koreatown, Garden Grove, Orange County, California, 92841, United States of America"
0.09705,33.768515,-117.950417,"Deanann Place, Koreatown, Garden Grove, Orange County, California, 92843, United States of America"
0.097051,33.772274,-117.988433,"Larson Avenue, Koreatown, Garden Grove, Orange County, California, 92844, United States of America"
0.097052,33.786902,-118.01438,"Amy Avenue, Koreatown, Garden Grove, Orange County, California, 92845, United States of America"
0.097059,33.816308,-117.808494,"Jocotal Avenue, Villa Park, Orange County, California, 92861, United States of America"
0.097063,33.8375,-117.847,"North Santa Fe Place, Greystone Crossing, Orange, Orange County, California, 92865, United States of America"
0.097064,33.794555,-117.855899,"North Cypress Street, Orange, Orange County, California, 92866, United States of America"
0.097065,33.797118,-117.850447,"Morlan Hall, North Center Street, Orange, Orange County, California, 92867, United States of America"
0.097066,33.793279,-117.862342,"West Sycamore Avenue, Orange, Orange County, California, 92868, United States of America"
0.097067,33.736471,-117.755999,"Narrow Path, Orchard Hills, Irvine, Orange County, California, 92602, United States of America"
0.097068,33.905285,-117.844108,"Imperial Highway, Old Town Placentia, Placentia, Orange County, California, 92886, United States of America"
0.097078,33.905073,-117.831254,"Chicago Avenue, Yorba Linda, Orange County, California, 92886, United States of America"
0.097079,33.888966,-117.703664,"Big Horn Mountain Way, Vista Bel Aire, Yorba Linda, Orange County, California, 92887, United States of America"
0.097081,34.384437,-119.299057,"East Old Creek Road, Oak View, Ventura County, California, 93022, United States of America"
0.097083,34.262892,-119.240051,"Barr Drive, Ventura, Ventura County, California, 93003, United States of America"
0.097084,34.293297,-119.168911,"Placer Avenue, Foothill East, Ventura, Ventura County, California, 93004, United States of America"
0.097088,34.386181,-119.437361,"Carver Summit Drive, La Conchita, Ventura County, California, 93001, United States of America"
0.097089,34.246429,-119.075276,"Calle del Norte, Spanish Hills, Ventura County, California, CA 93010, United States of America"
0.097091,34.215717,-118.996641,"Hidalgo Street, Camarillo, Ventura County, California, CA 93012, United States of America"
0.097092,34.375505,-119.472551,"Ralph Fertig Memorial Bike Path, Rincon, Ventura County, California, 93001, United States of America"
0.097094,34.37834,-118.936013,"Riverside Avenue, Bardsdale, Ventura County, California, 93015, United States of America"
0.097096,34.2756,-118.88,"Millard Street, Moorpark, Ventura County, California, 93021, United States of America"
0.097097,34.273201,-118.905962,"Heather Glen Court, Moorpark, Ventura County, California, 93020, United States of America"
0.097098,34.411071,-119.295022,"North Ventura Avenue, Oak View, Ventura County, California, 93022, United States of America"
0.097099,34.430592,-119.158001,"Sulphur Mountain Road, Ventura County, California, United States of America"
0.097101,34.192481,-119.174775,"Driffill Boulevard, Oxnard, Ventura County, California, 93033-3245, United States of America"
0.097104,34.164815,-119.137948,"Yosemite Drive, Oxnard Pacific Mobile Estates, Oxnard, Ventura County, California, 93033, United States of America"
0.097106,34.185999,-119.206683,"West Hill Street, Oxnard, Ventura County, California, 93035-1203, United States of America"
0.097107,34.225441,-119.193245,"Gardenia Street, Oxnard, Ventura County, California, 93036-2007, United States of America"
0.097108,34.413587,-118.794057,"Main Street, Piru, Ventura County, California, 93040, United States of America"
0.097109,34.179349,-119.195678,"East Elfin Green, Port Hueneme, Ventura County, California, 93043, United States of America"
0.097111,34.154941,-119.202472,"Pleasant Valley Road, Port Hueneme, Ventura County, California, 93041, United States of America"
0.097113,34.3554,-119.06,"117, North 10th Street, Santa Paula, Ventura County, California, 93060, United States of America"
