regionidzip,latitude,longitude,address
0.097116,34.260898,-118.671161,"Katey Lane, Santa Susana Knolls, Ventura County, California, 93062, United States of America"
0.097118,34.275482,-118.809331,"Algonquin Drive, Greek Track, Simi Valley, Ventura County, California, 93065, United States of America"
0.097119,34.28464,-119.001951,"Kingsgrove Drive, Somis, Ventura County, California, 93066, United States of America"
0.097164,34.749039,-119.090035,"Greenleaf Springs Road, Stauffer, Ventura County, California, United States of America"
0.097177,34.757954,-118.798107,"Ralphs Ranch Road, Caswell, Los Angeles County, California, United States of America"
0.097185,34.697879,-119.306322,"Lockwood Valley Road, Ventura County, California, United States of America"
0.097298,34.4879,-118.172,"Stallion Meadows Trail, Paris, Los Angeles County, California, 93510, United States of America"
0.097316,34.65692,-118.385257,"Cabin Drive, Andrade Corner, Los Angeles County, California, United States of America"
0.097317,34.690736,-118.135225,"Sierra Highway, Lancaster, Los Angeles County, California, 93536, United States of America"
0.097318,34.73396,-118.139298,"West Avenue G, Lancaster, Los Angeles County, California, 93536, United States of America"
0.097319,34.647495,-118.231883,"West Avenue L 14, Lancaster, Los Angeles County, California, United States of America"
0.097323,34.559273,-117.948597,"East Avenue R 14, Antelope Center, Los Angeles County, California, 93543, United States of America"
0.097324,34.47494,-117.841521,"Saint Anne Drive, Valyermo, Los Angeles County, California, CA 93544, United States of America"
0.097328,34.571089,-118.065097,"Clubhouse, Palmdale, Los Angeles County, California, 93552, United States of America"
0.097329,34.585014,-118.16201,"Ashberry Drive, Palmdale, Los Angeles County, California, United States of America"
0.09733,34.563376,-118.019104,"Giavon Street, Palmdale, Los Angeles County, California, 93552, United States of America"
0.097331,34.485886,-117.868996,"Valyermo Road, Longview, Los Angeles County, California, 93553, United States of America"
0.097336,34.814163,-118.307128,"100th Street West, Antelope Acres, Los Angeles County, California, United States of America"
0.097339,34.412306,-117.771902,"Largo Vista Road, Mile High, Los Angeles County, California, 93563, United States of America"
0.097344,34.5793,-117.949573,"East Palmdale Boulevard, Palmdale, Los Angeles County, California, 93591, United States of America"
0.399675,34.153308,-117.97968,"Barranca Road, Bradbury, Los Angeles County, California, 91008, United States of America"
